Text,Rating,Drug
"I started ozempic 9 months ago. At the time I was a little over 200 lbs and was taking 1000 mg of metformin daily. Metformin had worked for me for almost 20 yrs so I didn't expect that is had suddenly stopped working. For 3 years I gained weight even though I worked out, and I thought it was just my appetite out of control. One random day I realized my metformin was the problem. I saw a new dr who prescribed ozempic. What a miracle! 9 months later and I’m down 40 lbs, my a1c dropped from 8.1 to 5.6, and I have virtually no symptoms from the drug other than fullness. The symptoms in the beginning did not last long either. Nausea, headache, fatigue...all cleared up within a week or 2 each time my dose was increased. It can cause what feels like constipation but for me it’s just that I simply haven’t eaten enough. This drug feels too good to be true. I’m so pleased with my experience so far!",10.0,Ozempic
"I did one injection and have been ill since.
Have had acid reflux, burping, vomiting, constipation, headache and dizziness. I tried to eat small meals and drink plenty of water as directed by my physician, but I have been unable to hold anything down. 5 days after my first injection, I'm off work drinking pedialyte trying to get my strength back and avoid being hospitalized. This is the worst that I have ever felt in my life.",1.0,Ozempic
"I’ve been Ozempic for 4 weeks.  I am so glad that my doctor sat me down and told me what to expect.  She also asked if I could handle it.  She said that if you can make it through the 4th week I promise it will get better.   She was right.  I was pretty sick the first two weeks.  I learned that it had a lot to do with me trying to eat my normal intake of food.  Once I started to catch a clue and making my portions smaller, I learned it would make me feel better.  I could guarantee if I ate too much, I’d feel like crap.  People aren’t kidding about the side effects.   It’s real.  But I made it and am now starting to feel better with each day.  I’ve lost 18 pounds now and I’m amazed.   Yes it makes you sick but if you keep trying to eat like you did it will be worse.  You have to start listening to your body    You can’t keep eating your same amounts and expect to lose weight.",10.0,Ozempic
"Started on Ozempic Sept 2020, starting weight 312 lbs (5’ 4”).  I am type 2 diabetic and take 2550mg of Metformin daily. HbA1c was 79, sugar cravings and blood sugar out of control. Started on 0.25 dose, for a month. Quite bad stomach cramps and nausea for the first month. Went up to 0.5 on month 2, then 1.0 dose for month 3 and since. No 1 tip - inject into your leg rather than around your belly. Once I changed to injecting in my leg, nausea and cramps disappeared overnight & never came back. To maximise effectiveness, you can’t eat like you did before. I re-joined Weight Watchers in Sept. I have lost 80lbs in 5 months, HBA1c dropped from 79 to 51 which is normal type 2 level although the doc feels with more weight loss, it could go to normal levels. In Ireland, diabetes is classed as a long term illness so all medications are covered by the government so I don’t have to pay for this. Otherwise costs €195.",10.0,Ozempic
I took one Ozempic injection at .25 and ended up at ER 2 days later. I had horrible bloating. Burping smelled like eggs. Unstoppable vomiting and diarrhea. I ONLY TOOK ONE INJECTION and stopped the medicine. It has been 2 weeks and the medicine still making me sick. I'm just wondering how long it takes to fully leave your system? I just want to feel human again. I was tested for pancreatitis but was ok but dr said will repeat labs soon. I DON'T RECOMMEND THIS MEDICATION TO ANYONE. PLEASE BE SAFE TAKING THIS MEDICATION.,1.0,Ozempic
"Ozempic has caused me so much constipation !!! I know a side effect is diarrhea but it does the complete OPPOSITE for me . A day or two after I take my injection I have no bowel movements at all !! Every week I  am forced to take a laxative . It has caused so many problems for me . 
Anyone else experienced severe constipation . So frustrated",1.0,Ozempic
"I'm a 54 year old female who's a1c was 8.3 at the end of March.  So after 4 months on Ozempic, my a1c is now 6.3! and I've lost 34 lbs. Definitely curbs my appetite and I have been logging my food.  My side effects have been minimal, a little nausea in the beginning and constipation. This med has been a game changer for me. My hope I that many others will have the same results I have.",10.0,Ozempic
"I was terrified to take this after reading some of the reviews online, but I have to say I am so happy I started this drug. I've followed others suggestions about injecting the drug into my upper thigh and not my abdomen. I was on a .25 dose for 4 weeks then moved to .5 and that's what I currently take. My appetite has decreased SIGNIFICANTLY. I was addicted to eating junk foods, and I simply cannot eat them anymore, my stomach cannot handle them. I get full after eating one proper sized meal, and it keeps me going for most of the day, only having a snack like 1 apple in the evening. Side effects were mild for me, had some constipation but I started taking fiber supplements to help with that. I have been on the medication for 7 weeks now and I'm down 10lbs and I feel great. Make sure your doctor gets you to increase the dose slowly, inject into your thigh and be ready to make 
better dietary choices when starting this drug. I truly believe it saved me from morbid obesity.",10.0,Ozempic
"After reading this, that junk in the fridge will go in the garbage. 
Do NOT  put yourselves through this for weight loss and even diabetes.
I mean seriously, which is worse?
Pancreatitis? Thyroid cancer? Horrible gastro conditions? 
Injecting ourselves with this lizard juice can't be good for us.
And, it’s beyond expensive to say the least.
Pharmaceutical companies should be ashamed of themselves but that’s nothing new. 
This is totally off the charts.
Just say no to drugs these drugs.
Please be fair and unbiased and publish this comment, if you’re fair and unbiased!",,Ozempic
"I started Ozempic in late December at .25 injection. I also take 500mg metformin per day. Soon after I started Ozempic I had decreased apetitite and my sugars improved, but I had reflux, gas, bloating, nausea and diarrhea. After 4 weeks I started .50. 2 weeks in I have bouts of painful constipation then diarrhea, nausea, bloating, gas, reflux and cramping. I've almost vomited a few times. When I eat it feels like the food just sits and sits, barely moving through my gut. My doctor wants me to stick with it, saying that these side effects usually improve, but It's been pretty miserable. I'm thinking I'm going to stop taking it. While Ozempic has been effective in regulating my sugars and losing weight, I don't think it's worth the suffering that I've been enduring on this medication. I understand that studies showed it causing thyroid cancer in mice, but no one knows if it causes thyroid cancer in humans. I don't want to be the guinea pig the drug makers use to find out it does.",5.0,Ozempic
"Been on Ozempic since mid April 2020. All side effects listed with the worst being chronic diarrhea. Nausea has been significant, but has settled to occasionally. Trying to follow a more plant based diet I have lost today an official 60 pounds. I find the less meat I eat, the more energy I have, the better my blood sugars are as well. I am 53, so weight loss isn't impossible for us older ladies...",7.0,Ozempic
"I have been on 0.5 Ozempic for 2 months now. The nausea is no better. I vomit almost every day. Driving down the road and I begin to vomit. Almost caused me to wreck my car twice now. I've lost 30 pounds and feel terrible. My stomach hurts all the time and now my back. I do not urinate much at all even though I've increased water. Calling today and going off it. Losing weight is great, but not at the cost of feeling horrible every day.",5.0,Ozempic
"I have been taking Ozempic for 16 months and have lost 80Lbs! I started at .25 and have moved up to 1. At first I was terribly sick but I took my time to adjust bit by bit while the dose was slowly raised and now I don't feel sick at all from it now! If you can hold on and push through ( the push was hard, REALLY sick some days) it does get better. It has saved my life",10.0,Ozempic
"I was put on Ozempic after taking Gliperide for several years. I started on 0.25mg then on to 1mg. I started having the nastiest burps ever, then diarrhea 3 to 4 times a day. After 3 months I went to a gastroenterologist and was diagnosed with gastroparesis, a side effect of Ozempic. I  have all the side effects nasty ,offensive smelling burps, eye floaters in both eyes, bad diarrhea, stomach pain, now this disease that has caused pre cancer cells. Yes, my appetite has decreased, I have lost 15 lbs in 3 months, my numbers are good. But not worth being sick every day. Just found out my daughter is going thru the same exact thing. So take it at your own risk.",,Ozempic
Did the first 4 weeks o Ozempic @ .25 had mild stomach issues. Nausea was come and go really not consistent. Helped control my eating. Dr said if you over eat or eat like you used to you will throw up. There is no place for the over eating but up. Didn't over eat didn't have much issue. Took stool softener to keep things moving. At the .5 dose ate less but less side effects than my first dose. Glad I have started the med it works.,10.0,Ozempic
"I have been taking Ozempic for 4 months to reduce insulin resistance (caused by polycystic ovary syndrome).  The medication has significantly reduced my appetite.  I have had a few minor side effects - a stomach cramp here, an episode of diarrhea there...but nothing at all significant.  My weight went from 151 (BMI 25.9) to 133 three months later (BMI 22.8).  I honestly could not be happier.",10.0,Ozempic
"I started taking Ozempic in June 2020, initially lost 20 pounds by August. Total of 30 pounds so far, last 10 have been a lot slower. I went from 186 pounds to 156 pounds. A1c went from 6.5 to 5.6.  Minimal side effects include occasional nausea and constipation. Started using miralax which has helped. Side effects I have experienced are worth the benefits. I consistently wake up with glucose levels in 80-90 range, never out of green zone on glucometer. I cannot over eat. If I do I feel ill or get heartburn so I have learned my lesson. I am really happy with this medication.",10.0,Ozempic
"I took 1 dose of Ozempic and I have been sick ever since, diarrhea, vomiting, nausea, stomach cramps and a little dizziness. This is terrible,  will never use again. Can someone tell me how long these symptoms last?",,Ozempic
"Side effect is mild for me but it really destroys your appetite. Initially I can only tolerate fresh fruits and vegetable. I took this as opportunity to change my lifestyle. I eat healthier and avoided sugary drinks. I lost a total of 40 lbs. in 6 months. A1C dropped from 7.3 to 5.4. Dress size dropped from 14 to size 4. I am no longer on daily insulin, BP meds and cholesterol meds. All labs are normal. This medication is my lifesaver.",10.0,Ozempic
I've been on Ozempic for 8 weeks. At first it I had side effects of  a lot of nausea. Now I wake up cold and clammy the last week and very anxious. Overall feeling unwell. Wondering if anyone else has experienced this?,,Ozempic
"I suffered from
-Loss of appetite 
-Exhaustion 
-Nausea 
-Vomiting (once a week usually 2 days after my injection)
-Low blood sugar events (probably caused because just had no appetite)

When I spoke to my pharmacist she encouraged me to try to hang in there telling me it would get better and it finally has. I was not expecting it to take over 3 months though.
My readings are all good and I've lost 28lbs so there were benefits to sticking it out but it was hard. I had decided that I would continue to take the medication until my next appointment and if things were still bad I would tell the Dr that I  no longer wanted to use it. Things are better and my appointment is next week.",5.0,Ozempic
"Honestly am so impressed so far with these meds. My weight had 
 been creeping up due to insulin resistance (which itself makes it harder to lose weight) and PCOS. My doctor recommended I try this in conjunction with a very low carb and calorie diet. I started with a half dose of 0.25mg once a week injection and then after 2 weeks up to 0.5mg a week and so far in 6 weeks I’ve lost 15cm from my waist and 9cm off my hips, 5cm off my bust. I have been eating lite and easy roughly 1000 calories a day. Haven’t weighed myself yet as I’d prefer to see the difference in cm. This medication makes me feel a little nauseous the first day or two after my shot but after that I never feel hungry. I can quite easily eat a super small portion and feel full! I drink about 2L of water a day and do about 8000 steps at my job. It really has been great and sooooo much cheaper than Saxenda which was another one I was considering. Hopefully I continue to lose weight!",10.0,Ozempic
"I've been on it for 7 weeks. I have had the runs as others have noted and the sour stomach, but what I also noted is that those symptoms are worse if you've eaten too much, or a heavier meal before bedtime.  Small snacks are ok.  

I don't drink any sugar laden beverages, and I eat lots of fiber already.  My diet is mostly vegetarian, but not for any reason other than my stomach just feels better on it.  I think that has helped keep the side effects in check.

So far I've lost 8 lbs, which TBH is kind of shocking.  I never thought my body would give up this weight, but I'm heading in the right direction.  Sugars are dropping nicely, especially my fasting sugar.  I have that hypo drop and spike when you wake up, and that seems to be levelling off, which is great.  So I'm going to keep going. Oh and I didn't jump in with dosing, I started with .25 and kept on that for six weeks and only just now moving to .5.  Slow gradual is the right way.  Too much at once will make you sick.",9.0,Ozempic
"Listen to me- Ozempic will change your life- but you CANNOT eat synthetic sugar AT ALL. I had severe hashimotos, PCOS, insulin resistance and severe diabetes symptoms. HBA1C was high, all cholesterols were high despite the healthiest of diets. My numbers cleared from severe to perfect in 1 month!! I had full body swelling, severely cracked ankles, swollen feet, neck, legs, major hair loss… a nightmare. I began taking Ozempic- I was very sick. It made me extremely nauseous- I got severe diarrhea, but let me tell you- I lost 17 pounds of water weight in ONE month. My dr couldn’t believe it. In four months, I lost 40 lbs. the nausea was mild to severe the entire time, but the results were borderline insane. It reset my metabolism, took ALL of the inflammation away from my joints, neck, back, my feet completely healed within one month. It’s barely believable. I spent two months on .25 and increased to .5 once a week for ten more months. High praise!!",10.0,Ozempic
"I’ve been on Ozempic 6 months. I had gestational diabetes with both children so know I have an increased risk of type 2. I had bloodwork done and unsurprisingly my fasting sugar was high but my a1c was high normal. My doctor prescribed Ozempic and I am currently at 1mg/ week. Results: blood sugar in perfect range,  lost 20 pounds (15% body weight), loss of sense of taste for tons of foods, alcohol aversion. All in all I’m far healthier but I do miss enjoying food. I wonder if this is sustainable long term. Time will tell.",10.0,Ozempic
"I have been on Ozempic for 2.5 weeks now and I have lost 12 pounds. I don’t eat anything fried or greasy. I watch fat intake because this medicine can make you sick if you have too much fat in what you are eating. It can also make you sick if you overeat. If you eat small - moderate meals with light snacks in between, you will probably not have any problems. If you cannot stay away from fast food and greasy pizza, you will have a problem. I have found that this medicine makes me not as hungry. It takes the edge off. It also keeps me from craving junk. I get full at meal time, eating less. I drink a lot of water too. I also use an app on my phone to log food, calories and exercise. I weigh once a week. I hope this helps someone else that is considering this drug.",10.0,Ozempic
"I have tried them all! I was diagnosed with diabetes at the age of 18 and I will be 40 this September. When I say I have tried them all, it’s no exaggeration, but my search stops here!! This medicine has done in a couple of weeks what I have been trying to do all my adult life! My blood sugar is perfect! I actually look forward to testing my sugars throughout the day. The other Day I cheated and have a slice of caramel cheesecake. Normally, this would spike my blood sugars too well over 250, but when I tested my sugar one hour after consumption, I was at 132!! It only get lower as the night went on!! This is some good stuff!! I am so happy my doctor recommended this for me! I’m in love!! I’m finally optimistic about my future with this dreadful disease.",10.0,Ozempic
"I've been using Ozempic for 18 months. A1c has dropped from 8.1 to 6.0. Weight dropped from 195lbs to 157lbs. Minor side effects for the 1st two weeks, I dropped most of the weight within 4 months and my A1c went down to 6.3 in those 4 months. My doctor decide to take me off Ozempic after 6 months to see if I'd stabilized but within 4 weeks my A1c was back in the upper 7s. I'm staying on Ozempic for now. Great medication but a ridiculous price.",10.0,Ozempic
My husband began taking Ozempic for his Type 2 diabetes several months ago and experienced minimal unpleasant side effects. His food consumption is down approximately 2/3 (no more ,,Ozempic
"Started April 1. 2021 on Ozempic low dose. 3 weeks intervals it was increased. Side effects were constipation ( went on laxatives to help), pain in my back (severe), bloating. Week 11 increased to 1mg the side effects were major bloating, diarrhea, sounds in my stomach (crazy), nauseous, feeling under the weather. My appetite has decreased to the point that I only eat 2 meals a day that are small. My sugar levels have decreased from 7.1-5.2 A1C. I’ve noticed that I have been kept awake some nights like I’m nervous for some reason.? In the first 3 weeks I’ve lost 15 pounds. Haven’t checked since I want to wait but can feel difference . The pains in the stomach are really uncomfortable and the bloating I will try gas-x, for relief. When  I try to eat more than I should my body tells me that I’m full if I go beyond that point I get severe pains in the stomach for hours. But depends on what I eat. Going to stay with smaller portions/healthier foods.",8.0,Ozempic
"My health wasn't good so I fired the nurse practitioner I was seeing and got an internist doctor. Found out my Thyroid  was almost non-functional + high blood pressure & my pre-diabetes rate was doing a serious climb. 1 year later had me at the right dose of synthroid.
Doctor put me on metformin & phentermine & added ozempic 2 weeks later at .25. That was a rough ride, I was nauseated & dizzy a lot! I started at 265lbs and everyday I would see a pound or 2 come off. As of this morning I weighed in at 239 and I'm up to 1mg dose of ozempic weekly. I take the anti-nausea now just before my ozempic dose & that's it. I use doterra ginger. A1c down to 5! I'm glad I listened to my doctor & my pharmacist & stuck with it. Anything worth having doesn't usually come easy! I would like to get down to the 160-170 range, I'm 5'11 and thinner than that I start to look like Olive Oyl! OH Popeye!",10.0,Ozempic
"My doctor gave me Ozempic 0.5 to start with.  I always had upset stomach, diarrhea with most foods, and an overall sick feeling all the time.  I was able to ",,Ozempic
"Reading many of the reviews frightened me so I thought it was important to share my positive experience. I’ll first say, I’m horrified of needles. However, you can’t feel the needle at all, the medication going in sort of burns a bit, but that’s it! I’ve been on Ozempic for 5 months. I started at 254 lbs and started taking 0.25mg for 6 weeks. No side effects in the slightest. I also didn’t lose much either though because it is your body getting used to the medication rather than fixing your blood sugars. I then moved up to 0.5 and started seeing results with my weight and still no bad side effects other than eating less. I recently moved up to 1mg and am now down a total of 45 pounds in 5 months. Still no bad side effects. Eating has to be much more mechanical though because my hunger cues aren’t as strong, but no nausea. I would highly recommend this drug! Ps inject in your thighs, I believe this is the reason I’ve had no bad side effects my entire journey!",10.0,Ozempic
I've been on ozempic about 4 weeks now. Started at 0.25 now onto O.5mg. The only mild side effect I have is the sulphur burps other than that I don't really have any. The odd sick feeling but it's not too strong of a feeling. This medication has cut the sugar cravings in half to non  existent therefore have lost bit of weight which is noticeable. Food habits now are also none existant. I feel fuller for longer. This drug is amazing and to only Inject once weekly is fab! I do recommend ozempic highly. I Held a lot of weight around my stomach to which now its starting to shift. To me it's been a lifechanger and I hope to anyone considering reaps the same experience from myself on it. Gl x,10.0,Ozempic
"Since starting Ozempic all my numbers have gotten considerably better. I did have nausea for several months, but I took medicine to counteract the nausea and now I’m feeling much better.  My appetite has been cut in half.  I have lost a total of 40 lbs so far and I couldn’t tell you the amount of inches I have lost, it seems that I lost inches first and then weight. I have started going to the gym. My advice to anyone starting Ozempic is to stop eating as soon as you get that first feeling of being full, don’t try to finish the plate just because you don’t want to waste food, because it will make you sick if you force yourself to eat it all.",,Ozempic
"With an A1C approaching 11, it was time to try something else in addition to Novolog and Tresiba so my Dr added Ozempic.
I also quit all alcohol and became a vegetarian. The first 3 weeks at .25 left me with a decreased appetite, nothing severe. The pounds started dropping off, fast forward 3 months and I am 22 lbs lighter.
I love Ozempic, no bad side effects and my insulin needs have decreased ( not gone away) best of all my A1C was 7!
A lifestyle change helped a lot, but I credit Ozempic for many of these positive changes.",10.0,Ozempic
"I feel that the best practice for this medicine would be to take about only 8-10 clicks (17 clicks = 0.25) for the first several weeks and then build yourself up to the full 0.25 dose.  That way you can see what side effects you are going to experience and if they are tolerable of not.  I took 0.25 and suffered from severe diarrhea for almost the full 7 days. Ended up in the hospital for the last 4 days until the side effects wore off. The only positive, was that I lost almost 20lbs. I would be very careful taking this medicine.",1.0,Ozempic
I've been using this off label for weight loss for 3 months after consistent diet/exercise and allegedly controlled Hashimoto's left me frustrated that I still couldn't lose weight.  This drug has been amazing.  I do still suffer from occasional headaches that are moderate to severe and if I eat something I ,,Ozempic
"Do not take this medication!  After injecting the .5 mg dosage for two months, I began to have digestive issues. My doctor sent me for medical tests and found that I developed Pancreatitis.
I was told to stop using Ozempic immediately!",1.0,Ozempic
I’ve been taking Ozempic for eight months. I’ve had minimal side effects on a .5mg dose. I’m taking this for weight loss with Metformin and a low carb diet. I’ve lost 70 pounds from 265 lbs to 195 lbs. The change in my health has been remarkable. I call it the wonder drug.,10.0,Ozempic
"Hi! 

Have been on Ozempic for 10 months. The first 3 months were very difficult with strong side effects. Mainly constant, but low level, nausea, occasional vomiting, and diarrhea (especially two days after the injection). However around month 3 the nausea and diarrhea subsided greatly and my appetite returned. I had lost weight very quickly (42lbs in 3 months due to not really eating much). Had to take supplements for a while but am now eating well. The rapid weight loss led to telogen effluvium, a temporary hair loss condition. (I shedded A LOT but never showed any baldness or anything). Currently, my weight is still down (I was taken off my blood pressure medication!), my blood counts are perfect, my hair is getting thick, and I eat normally. I now experience virtually no side effects.  Really, really, glad I stuck out the side effects at the beginning.",7.0,Ozempic
