Text,Rating,Drug
"It's easy to use however the side effects are horrible.  I have had all of the listed side effects. Constipation and nausea and vomiting are the worst. It feels like a rock in my gut however, it's a little better than ozempic which I puked every day.  so I'm sticking with the Mounjaro for now.",6.0,Mounjaro
"I have been on Mounjaro to help loss weight for 8 weeks, 4 at 2.5mg & 4 at 5mg and have not lost weight, no appetite suppression at all. I can't tell I'm taking anything at all other than burping, acid reflux and stomach pain through the night after eating.",1.0,Mounjaro
"I was prescribed this medication after having an ESG procedure to help with weight loss and in hopes to reverse Type 2.  I also have PCOS and a family history of Type 2.  After being on this medication I am down at least 10 lbs (don’t remember my weight when I started) and my blood glucose is not in diabetic range.  My A1C was 5.9, down from 7.9 and I expect that to be lower on my next labs.  I do have some side effects the most prominent is constipation.  Miralax helps.  I used to get a headache after injection but I take ibuprofen before hand and that helps.  I also inject my thigh, not my stomach and I do it before bed.  I have to remember to eat and drink water.  I would recommend this medication.  I hope I’ve lost enough weight to get off and stay off.  So far so good.",9.0,Mounjaro
"I just started using Mounjaro 2.5 mg this morning. I hope to be able to update this post as I go in order to help others know what to expect.

The injection was a bit painful, felt much like a bee sting. I can't poke myself, so one of my children pressed and held the button for me. I looked up several videos to know how to give the injection, which is quite easy.

I'm taking Mounjaro to lower my blood sugar. I took it while fasting, as I've read that is recommended. It's been two hours and my blood sugar has dropped 60 points. I'm going to wait another hour to see if my blood sugar continues to drop. So far, no side effects. I've read that the foods eaten are the reason people get nauseated and have other GI symptoms. The best guide I've found says to eat protein (lean), fruit (no skin), and cooked vegetables. Foods to avoid are greasy, high fat, and sweets.

I'll update this, if allowed, as I experience changes, including side effects, blood sugar changes, and weight loss.",10.0,Mounjaro
This med Rybelsus is awesome.   It has helped me bring my A1C down to 5.1 from a high of 9.7. I first started with the 3mg and am now on the 14mg.  Been on this med since March and while I did experience some nausea and mild upset  stomach it went away after about a week.  It has also helped me lose 50lbs as well.  I also take with metformin.   I should be the poster child for this drug...even though I'm 50.,,Rybelsus
"I started taking Rybelsus at the beginning of August for weight loss.  The biggest con for me is that it causes constipation and then usually diarrhea when I finally do go to the restroom.  I have only had issues with nausea when I try to eat past the point of being comfortable. It is also important to try to eat something within an hour of taking the medication. When I first started on the medicine, I could only eat a few bites of food and then would feel extremely full and bloated and would have to stop. Now, It is 4 full months later and I am on the 14mg and I can continue to eat beyond a few bites without feeling miserable, but I try to stop as soon as I am full.  I have, so far, lost 30 lbs with no exercise and have gone from a size 12/14 to a size 6/8.  Diabetes does run in my family, so I am hoping continued use of this drug may help prevent the development of diabetes in the future.",10.0,Rybelsus
"It’s been a week on Rybelsus 3mg.  I feel pretty good (except for seasonal allergies).  No nausea, no vomiting, no diarrhea, smaller appetite.  I am prediabetic with BMI >30.  I would like to lose 30 to 40 pounds.  I think Rybelsus will help me.  (Prior to taking Rybelsus, I was fasting (16hour/8hour) and exercising EVERY day and STILL gaining weight.) I think Rybelsus will help.  I weigh daily, and I am beginning to see the numbers ever so slightly trend down.  I am optimistic.  I will start 7mg after 30 days.  I hope to come back here and share my journey with you.",10.0,Rybelsus
"For 2 years my diabetes went out of control, to the point that I started having some mental issues, like brain fog. My Doctor put me on 3mg Rybelsus. The first two weeks it was a bit of a struggle.  Nothing I couldn't handle. Just nausea and no desire to eat. A month in my Doctor took me up to 7mg. The first week at 7mg. Same nausea but after the week ended.  It was gone. I still don't have a major appetite. Which is excellent. My blood sugar is 104 at this moment. I've lost so far 24 pounds so far in 6 weeks.  I love this stuff.  I also feel much better and I can actually think with out the fog. I recommend it",8.0,Rybelsus
I’ve been on rybelsus since 1 December at a dose of  3 mg. January 1 started 7mg. I don’t like taking medication and was scared of this medication due to other reviews I have read. I am very pleased with the outcome. I lost 5 lbs with very little exercise. My side effects were nausea and lost of appetite. Nausea only occurred when I ate junk food and sweets. A1c down from 7 > 6.2. Plus I do not take any other meds for diabetes. Hope my review will help others.  February 28.,10.0,Rybelsus
"I have been taking rybelsus for 6 months.  At first I was nauseous and had bad sulfur burps.  But, it went away.  My a1c is the best it's been in 9 years.  I have had a hard go at treating my diabetes, as most other oral medications and daily infections,  just made life harder.  

Now, my numbers are 6.7 and I have lost a significant amount of weight.  335lb to 285lb, with minimal effort. It definitely suppresses my appetite.   I've read you can only lose a few pounds, but, I feel like a lucky one.",10.0,Rybelsus
"I took 3 mg of Rybelsus for about two weeks. I noticed right away that I was not able to poop normally. I thought constipation would resolve naturally since I don’t have issues with it normally. Now, I’ve been off of it for a week and I’ve had two ER visits because I can’t poop. I also struggle to pee because the thought is the backed-up poop is pressing on things it shouldn’t. Had to have a catheter drain me out. I did a week of Miralax, two days of Dulcolax, one ER cocktail, and an enema, and none of it has helped. At this point, I’m scared it will take surgery to remove the poop. If you’re taking this medicine please stay in tune with your body and mitigate early if you’re starting to experience any constipation.",1.0,Rybelsus
"I first took the 3mg dose for 30 days, I had no side effects and it is really controlling  my appetite. Now I am on 7mg so far my weight was 242, I have been on Rybelsus for about 4 months weight now is 215 hoping to lose more. No side effects feel better, light food craving. I hope to stay on this for 4 more months. Thanks Ryblesus. 
joe .c .",9.0,Rybelsus
"My Dr put me on Rybelsus in March/April 2020. I will admit the nausea was pretty bad for about the first month but I stuck to it because it was really working well on my blood sugar. Since I started I have lost 42 lbs!!  I have not been dieting but I do have some outdoor projects that required physical labor, like shoveling dirt, clearing brush, moving stones, etc. The nausea only comes back when my sugar is low and I really need to eat. I don’t even get a growling stomach anymore. I would recommend Rybelsus to anyone looking to manage your blood sugar and lose some weight.",10.0,Rybelsus
I was very frightened after reading the reviews. I am 52 and had gained from 130  pounds to 158 the most I have every weighed in my life. Stated the 3mg 3 weeks ago and have lost 10 pounds and no side effects other than occasional slight nausea. My appetite has decreased but for the better. I am walking 3 miles a day and eating very healthy. Stopped drinking soda now only flavored water. I consider this a miracle. Never lost weight this quickly. Happy as heck. Will continue the 3 mg and recheck A1C. So far this rocks. If it enables me to get in control of my eating and lose to a healthy weight to better my overall health then I call it a huge success. Love love love it!!!!!!!,10.0,Rybelsus
"When I first started the 3mg of Rybelsus, the nausea for the first 3 weeks was nearly unbearable.  However, like magic, around day 21, it stopped.  I don’t feel as full as I did at the beginning now that I’m starting my second month of 7mg.  However, I continue to lose weight with diet and exercise.  If you’re struggling at the beginning - hold on for 30 days - it might pass like it did for me!",9.0,Rybelsus
"I started taking Rybelsus 3mg.  Was nauseous at first and constipated.  I was also belching a lot. After 2 weeks,  that seemed to stop.  I've been on the 7mg for 17 days and the nausea, indigestion,  stomach pain and now diarrhea have been almost unbearable and are getting worse. I've also started feeling panicky and anxiety in the middle of the night with rapid heartbeat. I'm stopping the 7mg tomorrow and calling my doctor. I can't feel like this at Christmas. Going to see if she will put me back on 3mg. My A1C was 9.0.  I have no idea what it is now.  I've also lost 18 lbs because I can barely eat anything. This isn't worth it.",3.0,Rybelsus
Dr. ordered 3mg 30 days ago to be added to Metformin 2000mg.   Blood sugars have decreased to from 200-350 range to 120-150 range.  Weight reduced by 14#.  I experienced nausea and fullness for first two weeks.  That has tapered off yet the appetite suppression has continued.  After a month Dr. is pleased with the results as am I.  He has ordered me to continue on the 3mg and the insurance I have has agreed to cover it with a copay I can afford.  I am so grateful for this new med!,10.0,Rybelsus
"Dr put me on Rybelsus since I had bad luck with trulicity and feeling sick every time I took the shot. The first month of the dose 3mg I noticed I never ate, I had a complete lack of appetite. I was exhausted, weird dreams and a constant feeling of anxiety. Sometime insomnia. I put up with it. Second round with the 7 mg. The first day I was sicker than heck. I felt like I was on a cliff dangling, my anxiety turned into panic rapid heartbeat and unable to sleep. I stopped after day 4. Called dr left a message and she never got back to me. I am debating trying to take a 7mg every other day maybe or go back to the 3mgs and see if there is a difference now that it is almost out of my system. It is brutal to the body. The warnings say nothing about the anxiety feelings or the insomnia.",3.0,Rybelsus
"I’m prediabetic, Ha1c 5.7. And I’ve been struggling to loose weight for 20 years. I have an excellent diet but I eat too much. I’m hungry all the time. I started Rybelsus (paying out of pocket-Ouch) to see if it’s worth hassling my insurance company to a. On 3 mg I felt nothing, no nausea, but +loose stools. When I went to 7 mg I felt nausea for 1 hour after taking the pill and decreased appetite the rest of the day. I am easily staying on my 1400-1500 calorie diet, which has never been easy for me in the past.  At 1 month of 7 mg I’ve lost 8 pounds (255 to 247) and very encouraged. The science behind this medicine is inspiring.",10.0,Rybelsus
"I have been taking 3mg Rybelsus for 14 days for type 2 diabetes alongside Metformin. I have had no negative side effects from this medication other than a low blood sugar reading most days.
I take it around 6 am with a small amount of water as directed and then breakfast around an hour later. I have lost 14 lb in weight but I have started eating very healthy with a low carb intake. My appetite has reduced and my portion sizes have reduced as I do feel much fuller for longer.
So far so good.",10.0,Rybelsus
"My dr. put me on Rybelsus as I had high blood sugar. I had too much difficulty taking the 3 mg with nausea, diarrhea, and Headache. I planned to quit but I read the reviews here. I somehow managed my symptoms and tried harder. My dr. then increased dosage to 7 mg. Rybelsus was able to bring my blood sugar levels from 10.6 to 5.6 almost normal levels in a period of 3 months. If anyone planning to quit please persevere and the results are amazing. It practically stops your cravings for food and helps you stabilize. Another miracle was that I was finally able to quit coffee in the morning as I get migraine without it. Compared to the nausea and diarrhea and the churning of the stomach, migraine wasn't big of a deal and I finally went without taking coffee. This is really a miracle drug for Diabetes. Thank you.",10.0,Rybelsus
My A1c has been hovering around 7 and my weight was creeping up so my doc suggested this. I started on the 3 and the nausea and projectile vomiting was rough...indeed I didn’t think I could handle it. Then I discovered if I take it when I wake in the small hours to pee if I took it then I had almost no problems. I’m now up to the 15mg dose and so far I’ve gone from around 255lb to about 220lb and falling. Two whole jean sizes...haven’t done new labs yet...but the weight loss is remarkable...it’s also quite weird to essentially almost never feel hungry anymore,8.0,Rybelsus
"I started on Rybelsus and only took 4 doses. I didn’t get terrible stomach upset but my abdomen went completely numb. I’ve been off of the medication for 4 days and am still completely numb. Went to ER and they ran blood work and CAT scan, all was normal. I went to chiropractor and again all was normal. Numbness is listed as  rare side effect on drugs.com website which my chiropractor looked up. My endocrinologist isn’t helpful, and I called Rybelsus and they were less than helpful. I’ve now spent hundreds of dollars. I’m very concerned and praying this goes away. I am so numb it hurts to touch my skin. Beware of this medication!",1.0,Rybelsus
"Started the 3mg for one month and lost 7lbs. I read the reviews about the side effects and saw most have little side effects if taken early, so I take it around 5/6 am with little water. By the time I'm ready to get going for the day, I can have a cup of tea, as it says not to drink within the hour of taking it. 
My appetite has decreased, I don't pick/ snack and my portion size has decreased. 
I only ever feel nauseous if I eat too much, but I've got to grips with how much I can eat and to be honest, I don't really feel hungry. I was eating because I felt I should. No other side effects. On my second month so will see how it goes.",8.0,Rybelsus
"Was placed on this medication to help with PCOS caused insulin resistance and obesity. The first two months were a bit uncomfortable - I was nauseated a lot and had bouts of constipation and diarrhea. Fortunately, immediately starting it, my sugar cravings disappeared. 

I think I had a rough couple of months because of my old eating habits since this medicine slows how fast your stomach empties. As I developed better eating habits this has gone away completely.

I’ve been on this for almost a year now and have lost almost 60lbs. I’m about 5 lbs away from being a normal weight and I’m barely making any effort at this point; the weight is just coming off. I feel the healthiest I’ve felt in over a decade and have been seeing my PCOS symptoms reduce as the weight comes off. This medicine was a miracle for me. I’ve struggled for a decade trying to get my weight under control. Once the insulin resistance was resolved, it literally fell off.",10.0,Rybelsus
"I have read a lot of the comments. This medication has helped lower my A1C. I  am down from a 8.1 to a 6.5. When I started it , I was weighing 238 pounds now I weigh 217. I was wearing a size 18W/20W now I am at size 16W. I don't want to get too small. I like the way my clothes fit on me. The only thing that I have read about taking this medicine is that it can cause Thyroid cancer. So I may stop taking it.",10.0,Rybelsus
I started this 7mg along with 1000mg of Metformin in August of 2020 and I have lost over 65 pounds. I was insulin resistant and could not lose weight regardless of my diet. I’m 56 years old and this has been the easiest weight loss I have ever had and I have done it all. I did begin with a low carb diet but now I eat what I want in moderation. It had definitely helped with my appetite and I feel full quickly. I am under a doctors supervision and go monthly and all of my numbers are great. It may not work for everyone but for me it’s been a lifesaver.,10.0,Rybelsus
"Started Rybelsus when it first came out in October 2019.
Took 3 mg at first and my glucose levels started to rise.  Changed to 14mg and was on that for 6 mos.  Glucose went very low - I was tired and weak. 
A1C went from 10.1 to 5.2.
Changed to 7 mg. and feel so much better, glucose levels are still within normal limits.
I've had no side-effects and great results.
I do take this with 5mg of Glipizide - once a day.  Have tried many diabetic drugs and Rybelsus has worked the best.  I've had a slight weight loss ...under 10lbs.  So glad I tried this drug.  It's a winner in my book.",10.0,Rybelsus
"My endocrinologist prescribed 3 mg to start because the B12 depletion from metformin (I have b12 anemia) was not good and constant yeast infections from Forxiga were very annoying. At first,  I noticed a major appetite decline. There was a bit of nausea for the first 2 weeks. I started the 7 mg after a month and while I've been experiencing constipation, I am so happy about the weight loss. I've been on Rybesus for 10 weeks and have lost 10 lbs. My latest random glucose test had me at 5.7, down from 6.3 - 7 over the previous few months. I am happy about fewer carb cravings and will stay on Rybelsus as long as I can. I am lucky my health plan covers it because it's quite expensive.",10.0,Rybelsus
"Started on Rybelsus 20 days ago after I went in to see my doctor and my A1C was 11, this is while I was also taking pioglidazone and 2000mg metformin. After being on it for only 20 days it has  brought my blood sugar average down from 269 to 131. My 14 day glucose is 114, and my 7 day average is down to 109. I am hopeful that my next A1C reading will be 5.6. I did notice a little looser stool when I started it, but nothing worse then when I started Metformin. So far, So good. My only complaint is how expensive it is! I may not be able to continue it because of the cost.",10.0,Rybelsus
"My endocrinologist prescribed this to help with PCOS. I weighed 211lb and started on 3mg and lost 6 lbs while walking for 2 miles a day most days for a month. I was bumped up to 7mg, but insurance wouldn't cover it and I ended up gaining the weight back after trying Victoza and Byetta. My insurance changed and my endocrinologist started me back on it at 7mg since I already had Byetta in my system. During this time, I found out I have Ehlers-Danlos and was recommended to start weight lifting to help strengthen my muscles and lost 13 lbs in a little over a month which I'm sure exercise has helped contribute. My menstrual cycle has been regular and on time for the first time in 4 years. I haven't had any major side effects other than a little nausea when I first take it in the morning and diarrhea, but I had that issue beforehand. I know a lot of people have said the side effects are terrible, but it hasn't been for me and you should certainly give it a try. It's honestly been wonderful.",10.0,Rybelsus
"I'm disappointed with the lack of weight loss, however, my blood sugar is constantly lower as I'm type 2 diabetic. I need to lose around 6 stone and was hoping this would help. I'm a month into taking it and no weight loss. I was on liraglutide for 5 years, and that didn't affect my weight either. So disappointed. I hope I start to see some loss over the weeks.",5.0,Rybelsus
"I have been exercising, dieting, counting every calorie and weighing food and meal prepping. No weight loss and fasting blood sugar still over 160 after 24 hour fasting. Tried metformin, got diarrhea but no weight loss, no decrease in appetite. I need to lose 30 lbs and have lost 8 by skipping breakfast having lunch a d skipping dinner some days. If I eat before 5pm I don't get reflux and I sleep better. I am having night sweats but I'm 56 so menopausal.  I'm not taking hormones. I increased the dose to 7 mg had diarrhea for 3 days,  I'm up now to 14mg on an empty stomach. No more diarrhea, and I have energy. I am 142 now and trying to eat healthy but mostly eating no more than the size of my fist and staying as active as I can, I'm feeling cravings go away.",10.0,Rybelsus
"I've been on Rybelsus for eight months, and I have lost about 34 lbs. I started on the 3mg dosage, and after two months, moved up to 7mg, where I have stayed. 

However, one of the major side effects is slowed gastric emptying, which can lead to extreme stomach pain if you make the mistake of eating too much in a day. After a couple of bad episodes, I had an endoscopy, just to be sure nothing else was wrong - but ultimately, my gastroenterologist said that it's just the effect of the Rybelsus.",8.0,Rybelsus
"Second day on Rybelsus 3mg. Was too afraid to try it, but glad I did. No side effects at all except the loss of appetite. I will return and provide an update. I need to lose 60lbs. Have tried Victoza & Invokana and got very sick within the first couple days of taking them so I hope Rybelsus is the answer for me. I exercise and watch my diet, but my glucose levels were still too high.",10.0,Rybelsus
"I have been on Rybelsus for 2 months, I started on the 3mg and did fine, no side effects and actually felt more awake and focused. Then I went to the 7 mg and was very nauseous and vomited almost nightly. Felt like my food never digested. I apparently am pretty sensitive to this medication and since my blood glucose and A1C have been good I am taking this every other day which has lessened the nausea and discomfort. I have lost 6 lbs in the past month and that has been great cause I needed that. So we will see how this continues but I feel pretty good.",9.0,Rybelsus
"I have been taking Rybelsus for several years now. Before Rybelsus, I was taking Victoza. I have type 2 diabetes and both of these drugs have been complete game changers in my life. My A1c is now below 6 (usually 5.6 or 5.7), my weight is under control, and all my lab results are excellent. But these drugs do cause digestive issues that can be hard to deal with. Intestinal pain (sometimes in the middle of the night), constipation and diarrhea. It's almost like I have IBS and sometimes the side effects are overwhelming for a short amount of time. For me, the positive effects for my health outweigh the side effects.",8.0,Rybelsus
"Bad news: I started taking the 3mg Rybelsus for 30 days did well.  Have been taking the 7 mg for the past 3 weeks and I have had diarrhea, stomach bloating, nausea, and can barely eat anything or drink.  Even the smell of food makes me sick. I am extremely exhausted and hate feeling like this.  Calling doctor tomorrow.  
Good news: dropped a1c from 8.4 to 7.3 in 6 weeks and lost 10 pounds, and also cut back in my 24 hr insulin and fast acting due to not eating.  
—is it really worth it though???",3.0,Rybelsus
"This is the first medicine I've used that has actually helped me lost weight. I take a bunch of psych meds that have packed on pounds (Seroquel).  I started with the 3mg titrating package and had slight heartburn for a few days. By the end of a month on 3mg I lost ~6lbs. I had slight nausea at first on the 7mg dose (after a month on 3mg) but that faded.  Now, after a month on 7mg, I'm down a total of 14lbs total (233 to 219). Before this med I've been trending only upward for the past 4 or 5yrs. I'm super stoked that I might be able to see under 200lb again in a few more months.",10.0,Rybelsus
"I just got my A1C after 3.5 months on Rybelsus (one month at 3 mg and 2.5 at 7 mg), and I’m very excited that it’s dropped from 7.8 to 6.5! I have had some side effects - mainly stomach pain, gas, and occasional constipation-but the results are worth it. I haven’t had any significant weight loss, but my BMI was under 27 to start with, and because we had Thanksgiving recently I normally would have gained a couple of pounds. If you have just started and are having side effects, try to hang in there. The first month was the worst for me.",8.0,Rybelsus
"I'm 75, 180 lbs. I was diagnosed with T2D 10 years ago. My A1C was 9.2. I was put on Metformin 2000mg, A1C went down to 6.2 and since then I was swinging between 6.2 and 7.2. I eat lots of carbs and my physical activity is a one-hour walk three times a week. I feel hungry most of the day. My endocrinologist recommended Rybelsus, the family doctor said I shouldn't do it. I decided to go and see what happens. First month: 3mg plus Metformin 2000mg. No change in diet and exercise, lots of carbs. Minor nausea, A1C went down from 6.8 to 5.7, lost 10 lbs., morning sugar down from 135 mg/dl to 105, 2-hour sugar after meals down from 250 to 140. Second month: 7mg pills split in half. Terrible constipation for the first week. Stopped taking pills for 3 days, constipation persists with a lesser extent. Switched back to 3mg. Minor nausea, after a week, constipation almost gone. Weight no longer goes down. A1C went up to 5.9. To be continued...",8.0,Rybelsus
"I am on week 2 with Rybelsus. I started week one with 3mg. No side effects, no weight loss, slight nausea and greater appetite. I need to lose 20 lbs and instead, I am hungry all the time. Called my doctor. He told me to double up on the 3 mg, bringing it up to 6 mg. Still, no side effects, very slight nausea but increased appetite. Ugh! I want it to work so much. I will stick to it and see what happens.",5.0,Rybelsus
