Text,Rating,Drug
Iam a 70 yr. Old diabetic and have been type 2 for 15 yrs. Started victozA last week. I immediately felt better no more headaches and my morning   blood glucose is under 100 for the first time in years. Iam running 3 x a week and eating low carb diet about 45 carbs per meal as directed by Dr. Iam losing weight about 2 pounds in first week. I have not noticed any negatives with victoza other than some flatus and stomach rumbling. My cravings for sugar is diminishing and I have alot of energy. I would recommend any reader to go to a dr. Who specializes in endocrinology and get a diabetic nutritionist to set up a meal plan for you. Also key is to exercise daily and stay positive. Even though you are a diabetic by taking care of your body .,10.0,Victoza
I have been taking Victoza since February of 2017. At first I had nausea and constipation. I upped dose to 1.2 and was really feeling bad. When I went up to 1.8 it was continually making me feel sick. My doctor told me to go back to 1.2. After a week on the 1.2 things started getting better. I still have the nausea but it is only sometimes. The constipation I solved by taking a stool softener. I feel full after eating about a 4th of what I used to. Sometimes just the thought of food makes me feel queasy. The best thing is the weight loss. I started out weighing 323 lbs. I went to the doctor today and my weight is down to 280. It feels so good to lose weight without feeling hungry. A1-c number went down from 9.3 to 6.6.,,Victoza
"Wow, I have been on Victoza 2weeks, also take 1000mg metform daily.  My blood sugars now range 70-115.  Losing about 1# per 2days.  Little nausea first week, but gets better. Amazed, and Publix grocery store covers this med 100% so it's free with a Rx",9.0,Victoza
"Started victoza in decemberror  2015, now in April 2016, I'm down 45 lbs. It has help control my appetite. I have some constipation. But no other symptoms. I was on Lantus but have been able to stop using it and blood sugars have remained in low 100's. I am currently on 1.2ml.",9.0,Victoza
"I started taking Victoza on 10/18/2014 & the 1st 4 days I was fine I had a slight headache, the 5th day I was dizzy & vomiting I couldn't keep water down. I skipped a day of Victoza & started back the following day, no problems  I'm down 7lbs.",9.0,Victoza
"I've been in victoza for 18 days started with 1.8 since day 1, I was a little weak and constipated for the first 3 days but after that I started to feel good again, so now I only eat 3 little meals a day and I've lost 6 pounds so far from 202 to 196.",10.0,Victoza
"I have been on Victoza for six days now. This is great, way better than Byetta. I had neck surgery and over the past three years, I have received steroid injections and it made me a borderline diabetic. My sugars were fluctuating like a roller coaster until I got on Victoza, now it is great. My blood sugar in the morning is like 80 to 85, and after eating like 115, 120. I will post in a couple weeks.",10.0,Victoza
"I lost 8 lbs in 7 days but by the time I upped the pen to the middle dose I had no appetite and even when I tried to eat I gagged.  I had to drink Boost to get something in me and was very weak, shakey and my heart was racing.  I waited about a month and tried again planning to stick just to the lowest dose.  By day 7 I had lost another 5 lbs and again was weak, and could hardly eat.  Started having stomach cramping as well.  I will not take this no matter how bad I want to loose weight or control my type 2 diabetes.",1.0,Victoza
"Started with .6 about 6 months ago. Nausea, dizziness,  heartburn and loss of appetite. Not pleasant .
Blood sugars did not seem to improve - questioned if stress due to symptoms was counteracting each other. (Stress raises glucose).
Decided to give the drug it's best shot so after two week increased the dosing to maximum. (1.8).
Slowly symptoms subsided and post meal glucose came down. Down substantially.
Fasting still remains around 130 to 140 but that also is improved. Post meal about 140 if I eat a proper diet.
While I would have preferred a greater reduction in numbers the drug is beneficial. Side effects are now all gone.
I'm 64.",8.0,Victoza
Within 4 days on the 0.6 dose my fasting blood sugars came down to 114. I'm not hungry. Before I started Victoza I was taking 20 units of Lantus and 2000 mg of metformin a day plus eating a low carb diet. I am slightly dizzy and get mild eggy burps and have some bathroom issues along with mild nausea. I plan to titrate up to the 1.2 dose by one click a day to help offset the side effects. Sipping on diet ginger ale seems to help calm the queasy. I hope this medication continues to work for me without bad side effects because this is literally the first time in years that my blood sugar is in a normal range.,9.0,Victoza
"Started Victoza 3 weeks ago, have had some muscle discomfort in my back, nothing major. What I have had that is major is a 15 pound weight loss bringing me down to the weight I was in College and blood sugars in the 90s to 140s. My 14 day average is down to 112 from 195, 6 months ago. This medicine works! Now if I can just get my insurance company to cover it. After all it is saving them money on all the other drugs I was taking as well as helping me be healthier.",10.0,Victoza
"So far I have been on Victoza for three weeks now, at first being on the 1.2 dose was very nauseating, so I went back to 0.6 and that reduced the nausea, but that was not the solution to the blood sugar highs, now being back to the 1.2 dosage the nausea is not bad and my hunger is so reduced that I now have to force myself to eat.  My only main side effect so far has been the headaches.  I love the fact that I only have to take this once a day.  Insurance companies and the government need to take note of the successes some are having and start including this on all medical/prescription plans.  ",8.0,Victoza
"I have been on Victoza for about 6 or 7 years.  I really do love it because my A1C is constantly around 6, I'm on 1.2 dose, and since I have lost approximately 45 lbs I am really happy about that.  My only issue is the cost when I'm in the donut hole it goes up by $119.  I'm sincerely considering changing this med to another more affordable one.  I just can't do insulin.  I'm in a pickle.  I'm so torn especially since I have absolutely no side effects.",10.0,Victoza
"I'm 64 yrs old, 5'2",,Victoza
Took metformin and victoza for about 2 years I lost a lot of weight with it and sugar levels were low. But I only have one kidney. I now have chronic kidney disease because of these medications. I also have a bundle problem with my heart from using victoza.  I was dehydrated all the time with victoza no matter how much water I drank,1.0,Victoza
I have been on Victoza since 5-9-14 started with .6 and on 1.2 now. I have noticed my reading are now 80s to 150.  This medicine is doing a great job. I am now off my glipizide and metformin and only take the Victoza which has caused no side effects that others have spoken of.  I think this is a great medicine for diabetes.  Thanks Victoza.,9.0,Victoza
I have been taking Victoza for 2 years now. It works great my A1C is 5.6. However I wish the pen would be more user friendly. The dosage is hard to push through all the way. It should be one click and it’s in. I’m an elderly and have limited strength to push with one hand.,6.0,Victoza
"I have been diabetic for 27 yrs, sugars are uncontrolled. I have hypothyroid which makes it so difficult to lose weight. But last month my doctor switched me to Victoza. Since then I have lost 8 lbs! My sugar is great!  My cravings are gone. And I feel full longer and no desire of over eating!",9.0,Victoza
"I had been on Byetta and Metformin for twelve years and had maintained an A1C in the mid 5 range.  I had suffered no Diabetic related complications.  My treatment was successful. 

Then, my insurance insisted I change to Victoza.  It did not work and I had severe headaches, nausea, vomiting, and diarrhea.  The diarrhea was so severe I was constantly dehydrated and then my vision began to change.  My AIC jumped to the high 7's.  The drug was a disaster for me.  

I had to move heaven and earth to get back to Byetta and my AIC is coming down but the Byetta doesn't seem to be as effective as it was prior to taking the Victoza.  I have to wonder if the Victoza has left some residual problems with the pancreas not responding as before.",1.0,Victoza
I have been on Victoza for approximately 3 months.  It has brought my A1C down from 11.7 to 5.8.  Had headaches and nausea the first couple of weeks - that has passed.  I used to wake up with sugars in the 300s (dawn phenomenon) - now my sugars are stable at 100-115.  I also lost 17 pounds in 2 months so far.  This drug works but unfortunately my insurance refuses to pay for it because it is too ,,Victoza
Have to continue this after getting prior authorization. Insurance let me have Victoza for 4 times more the previous copay but Novo disk had that discount card on the website I requested and now my prescription is only $25. Basically the medicine stops my carbohydrate addiction and puts me back in control of what I eat and how my body burns fuel.  This is worth it.,10.0,Victoza
"I have been on Victoza less than a week and at first my sugar went down from 160s to 109. Then it started increasing, back up to 160s. At the same time I started getting severe abdominal and back pain (maybe pancreatitis). I also have severe nausea and just the thought of eating makes my stomach sick. I'm not giving up but have to make a trip back to the doctor.",1.0,Victoza
"I took victoza for well over a year, and it improved my blood sugar readings tremendously.  My A1C had been as high as 9, and it got down to 6.9 with victoza.  However, I was sick SO MUCH! Constant diarrhea, burping (the nasty, boiled egg kind), and extreme nausea and vomiting.  I finally started tracking my sick days, and  in one month I was sick 4 days.  And by sick, I mean throwing up every few minutes, all day long. I had several tests done, and the only thing discovered was that I digest food slower than normal, which is what victoza is designed to do, I decided it was probably the victoza making me so sick.  I stopped taking it completely, and have not been sick for over month. Blood sugars are not good now, so waiting to see my Dr.",10.0,Victoza
"4 week update: Well I'm a bit disappointed. I started Dec 28th, 2015 and was doing well until the past couple of weeks. Brutal constipation and upset stomach. Gastritis attacks. That was on 1.2 dose. Dr told me to stop it for a week and then try again at 0.6. I am going to do this as I really like the med. It lowered my blood sugars from 13 to 5.7 and I am losing weight and the appetite suppression is great. I tried to forge through the side effects but my stomach was too bad and I was missing work. I don't want to scare anyone about this review. Just give it a try. I was scared at first. Will update again when I re-start.",8.0,Victoza
"I've been on Victoza since July 2010.  As of December 2010 (5 months later) I have lost 50 lbs, appetite has been still not much since I've been on Victoza.  My blood sugars have been in the average of 140s 2 hours after I eat and feel great!  I hope this keeps up because it does help me with the weight loss issue as well as my type 2 diabetes!  When I first was on Victoza I had really bad headaches and nausea and some diarrhea.  But that lasted about a month to month and a half and since then I have not had any issues with side effects. Greatly recommended prescription for those who have tried everything under the sun to keep sugar in control and the only possible next step was going to be insulin.  I would recommend to give this medicine a try.",10.0,Victoza
I just started this drug last week and I have already lost 4 pounds after struggling for a year to lose only 1-2!!  I haven't had much nausea either which my doc said I might.  This could be my miracle drug!!  Thank you Victoza!,10.0,Victoza
"I started Victoza early March 2010.  My blood sugars have been great.  I use Victoza and 500mg of Glumetza 2x a day.  

For the first four months I was never hungry and I was amazed that I had so much control over the food I ate.  I lost about 40 pounds.  It really did feel like a miracle.

Sometime around the end of June I noticed I was getting hungry again.  In July I gained back six pounds.  August I gained an additional six pounds.  It's September and I'm hungrier than ever and I want to eat ALL of the time.  

I've tried going off of the Victoza for a five days and used the Byetta hoping I would regain some control again.  It didn't work.  At least not after just five days.  

I want the control back. ",,Victoza
I have been taking Victoza for 4-5 weeks.  Seems to keep my sugar in line.  Was 190 - 240 range  no 71 -117 range.  I was a little naucious the first week at .6 dose BS 110-138.  Next week went up to in between .6 and 1.2 dose.  Some headaches but experienced a full day of diarrhea (it was hell for that day).  Stayed at that dose for almost 2 weeks blood sugars were 91 - 135 mostly below 120.  Testing 6-8 times a day.  Increased dose at about the 3rd to 4th week to 1.2.  Blood sugars are mostly normal 71-122.  Although fasting mornings BS is 135- 155.  Yet I test in the middle of night my BS is 99-107 (I am experiencing insomnia). I have been experiencing loose bowel movements and diarrhea for the last 2 weeks.  I hope to go back to normal.,8.0,Victoza
"My last post here I had just started on Victoza and was  complaining about nausea. I lowered my dosage a few clicks and the nausea went away. I then slowly increased my dosage and its been working great. I suggest you contact your doc before trying this.   

I'm still not up to the full 1.2mg dosage, but I'm getting there. Sugars  are normal and I too am losing weight. I am EXTREMELY happy with how this medicine is working.",10.0,Victoza
"I've been on it for 3 months.  I started with the smallest dose and went up to the highest.  At the lower dose I started seeing my fasting numbers go down significantly.  At the middle dose, they leveled.  At the higher dose, I was sick to my stomach with anything I ate.  I was a zombie for a few hours.  The first two months, my A1c went down significantly.  The interesting thing about the med is that I never got the diarrhea, instead, it has given me constipation.   I haven't lost any weight.  I'm on the middle dose now.  Another interesting thing about the med is that at the middle and higher dose, I am hungry all the time.  I feel like I'm eating more than before.  My fasting numbers are back up.  I don't think it's working for me.",4.0,Victoza
Didn't do bad on .06 the first week but still had a strong urge to eat. Had diarrhea and headaches. Then I started 1.2 two days ago and today I was so nauseated I prayed to vomit. Then I started vomiting and it won't stop. I take medication other than victoza every night at bedtime including metformin and a few minutes ago I threw up most of my pills from last night still intact but swollen. The food from 4 days ago smelled like roadkill. I fear how long it will be before someone dies of an overdose from old medication in their stomach not digesting in time for future doses. It's been more than 20 hours since I ingested anything but water and a vanilla breakfast shake. I will not be taking my regular meds tonight. Victoza is out!!!!!!,1.0,Victoza
"I changed doctors. The one I was going to did nothing for me no matter what we tried. I'm a 64 year old male who was diagnosed with Type 2 Diabetes about 4 years ago. Started seeing my new Endocrinologist July 20th, 2011. First thing he did was stop me from taking Actos. Second thing he did was put me on a Testosterone Gel, and the most important thing, had me start Victoza. My headaches, and upset stomach were minor, and ended about 10 days after starting. I'm about 5'4",,Victoza
"I started on Victoza 3 weeks ago.  0.6 for one week and then increased to 1.2.  The first week was horrible.  I could not keep anything in my stomach.  Doctor told me to drink lots of water, but I could not keep that down either.  Now, at 3 weeks, I no longer experience any bad side effects, ",,Victoza
"I’ve been on Victoza for 3 months. I had horrible reactions to Ozempic. I have a very overly sensitive stomach with other GI issues. Ozempic made me very sick and I read better reviews on Victoza. I have been on .6mg for over 3 months and if you are having issues with higher doses, I strongly encourage keeping at a low dose. It was extremely effective for me! I tried to increase to 1.2mg and after 5 days my body started feeling the same effects Ozempic did so I went back to 0.6mg. My A1c went from 7.2 to 6.1 in 3 months!! It also had the opposite effect of the 1.2mg which gave me severe diarrhea the 0.6mg actually gives me normal BMs since I already have an ongoing GI issue with diarrhea. I honestly love it! I was told doctors don’t prescribe .6mg because no clinical studies weren’t done on this dosage, but this seriously worked great in 3 months. I’m giving it a 9/10 because I still get annoying gas and painful stomach cramps now and again, which can be annoying.",9.0,Victoza
"The first week was the worst, started at 0.6. The diarrhea was bad. Even worse the weird belching, the burps were gross. It was like my body was getting rid of actual dirt in it. By the time second week rolled around and I had to increase my dose to 1.2 most of the ",,Victoza
"Tried metformin & other oral meds but none could control my fasting levels & met forming makes me very nauseous.

Endo suggested Victoza. Gave me samples to test. Lost about 10lbs in the first 1-2 weeks of using it. No obvious side effects, initially. Sugar levels seemed to normalize & I had a complete loss of appetite. All seemed well.

The samples ran out & I went for a period not using it while I awaited an endo follow up. I could see the difference in my blood sugar levels when I stopped.

However, after getting back on it the weight loss did not continue. 

The longer I use it the less it works. Now experiencing shortness of breath. Seeing a cardiologist tomorrow.

Side effects I've experienced are constipation, extreme fatigue, shortn",5.0,Victoza
"I have been on Victoza since February 2015.  I have lost over 60 lbs.  I have had no side effects other than black and blue at the injection site.  I was also taking Farxiga with the Victoza.  Had stupid side effects with Farxiga, runny nose constantly.  I am now off of Farxiga and just taking Victoza.  For me personally Victoza it is great.",10.0,Victoza
"I've been on Victoza for about 18 months.  My doctor suggested it initially to help me with weight loss while supporting my Type II Diabetes.  My glucose is now well within normal range.  In fact, my doctor suggested I might want to consider stopping the medicine for a few months, and then retest my A1C level.  However, as soon as I stopped, I started eating too much again.  As I'm still trying to lose weight, I immediately went back on the Victoza and will try again in January when, hopefully, I will have lost a few more pounds.  No regrets on this medicine (except the high price). ",10.0,Victoza
"I was told I was a diabetic 2 years ago and could not lose any weight or get my HA1C down until Victoza.Now I've loss 51 lbs in 5 months. My HbA1C went from 13.1 to 6.9 and blood sugar levels went from 285 to 115 on an average. I changed my eating habits and watch just what I ate, which I couldn't control before. I had no side effects at all. Victoza has really helped me. I'm on metformin too but hoping one day I'll be able to get off of it.",10.0,Victoza
I started victoza just under a month ago and my blood sugars levels were high. My a1c was 7. 5. I experienced a mild nausea in the beginning but it has gone away. My am fasting range from 94 to 108. My sugars are definitely under control! I have lost 17 pounds and feel great. My eating habits have changed. All I seem to want is fresh fruits and vegetable and very little meats. Plus I am full after a few bites! It has been a blessing for me!,10.0,Victoza
I was on victoza for 3 months and got really sick. Dr took blood and my lipase and amylase numbers were off the chart. He told me I had pancreatitis. I will never take this drug again. I have never been that sick ever.,1.0,Victoza
I've been using victoza for 3 months now. 1.6 for few weeks then 1.8.  I had one night of sickness at beginning and another recently but in general it's more like the thought of eating food that makes me feel sick. My bowel and stomach feels a lot like I need to have an evacuation but I've not had diarrhea. As for weight loss I've gone from over 17 stone to 14st 7lbs in 3 months without doing anything. My Hbc1a has dropped from over 25 to around 7.. So everything is pretty amazing. I'm lucky that it's free for me in UK but it did take a few years to get it prescribed by my diabetic specialist nurse.  I don't know if there are any long term side effects but at present I believe it has changed and saved my life.,10.0,Victoza
Have been on Victoza for 1 1/2 months. Have lost about 10 lbs which is good for me. BS is great now I am at 1.2mg.  My only real complaint is that I get very sleepy about 2 hours after the injection. Have mild constipation and occasional nausea after 2 weeks. Initially had bad nausea. I am real pleased with how it is working for me so far.,9.0,Victoza
"I have been on and off Victoza for a few years now.  I had the really bad gastrointestinal side effects the first time I started it and milder side effects each time I stop and restart.  I never get much above 1.2 before I start getting life-changing insomnia.  I am not positive it's due to the Victoza, but it goes away when I stop it and starts when I restart.  Very frustrating.  However, my blood sugar rarely goes above 100 anymore and I am down about 30 pounds from when I started taking it.  It's really minimal weight loss over two years but the effect it has on my Type 2 Diabetes is astounding.  Now I'm just struggling to find the right dose so I can get some sleep.  Any advice would be appreciated.",8.0,Victoza
"Been on Victoza for about 3 months. Lost 20+ pounds. Started at .6 for two weeks then upped to 1.2 for a week and 1.8 since then. I've tried everything to control my blood sugar. Before Victoza, I was running about 165-195 in the morning and 140-150 all day. Metformin made it higher. Xigduo made it higher and had horrible side effects. Tried a few others with zero positive results. 

Victoza worked the best once I hit 1.8 dose. My morning BS is never higher than about 110 and I'm always <100 throughout the day. 

The biggest thing is that it completely controls my appetite. I work from home full-time and used to snack all day. With Victoza, I have to make myself eat and I eat very small portions. I'm just not hungry AT ALL. Love it!",10.0,Victoza
"I have been taking Victoza for 2 weeks. The first week I was on 0.6 mg and on the 2nd I started the 1.2 mg. I have lost 10 lbs so far. My biggest issue is soda, with this medication I am not able to drink it or anything with sugar without feeling really horrible, so I have switched to zero sugar teas and lots of water. I also find myself not being able to snack throughout the day and also eat much smaller portions at dinner and make better choices. Anything fried or sugary will result in a horrible stomach ache and headache. I will keep you all posted with any updates. I have started walking to see if that helps me lose weight. My starting weight was 275, and now I am at 265. I still experience nausea, but it comes and goes, and it was really bad the first week. I also experience stomach cramps and other symptoms in the restroom, both going too much or too little, but overall the symptoms have gotten better over time.",10.0,Victoza
"Using Victoza for about 5 weeks, I feel a whole lot better generally, with stable blood glucose.

With regard to food, I eat smaller, choose better/more balanced food, I have lost around 10kg in total in this time and this alone has made a huge difference. I also consume pre/probiotics daily now and this helped with the GI disturbances.

As for side effects, I had nausea, dizzy spells, gut ache/cramps, reflux, felt rather tired in the first 2 weeks. All dissipated in the first 4 weeks. At the time I told myself I prefer to feel like this in the short term than head into a future potentially suffering from the plethora of illness brought about by Type 2 Diabetes.

It works for me. Give it a chance.",10.0,Victoza
I was warned of the nausea but after a few days that did slow down I find eating smaller meals and taking some ginger gravol pills help its the non drowsy kind ..am surprised how fast it started working cause I tested myself last night and hit a seven like haven't seen a seven in ages it agrees with me. not had those other symptoms just the nausea for a bit I take the ginger gravol or drink a ginger beer and am good usually,,Victoza
"I have just begun this medicine for 2 weeks. 
I am Type 2 Diabetic for 20 years and didn't control my sugar level very well. I had a heart bypass (triple 3) last year. This medicine works well for me. No side effect. I began from 0.3 because I have to be very careful with my heart condition. Now, I am with 0.6 now. my sugar level is very good, always around 5.6-6.0. I am going on with it to see what happens. It is very expensive for me but I think life is more precious.",9.0,Victoza
